{
  "$schema": "https://json-schema.org/draft/2020-12/schema",
  "title": "Audio Specification for Rendered Musical-Grammar Demonstration",
  "description": "Schema the LLM emits as JSON in section 9. The synthesis engine reads this and renders a 30–90 s demonstration. Every field must be consistent with the grammar described in sections 2–6 of the field notes.",
  "type": "object",
  "required": ["duration_seconds", "pitch_system", "rhythm_system", "voices", "form"],

  "properties": {
    "duration_seconds": {
      "type": "number",
      "minimum": 30,
      "maximum": 90,
      "description": "Total length of the demonstration."
    },

    "pitch_system": {
      "type": "object",
      "required": ["encoding", "reference_hz", "pitches", "octave_repeats"],
      "properties": {
        "encoding": {
          "enum": ["ratio", "cents_above_reference", "hz_absolute"],
          "description": "How the pitches array is interpreted. 'ratio' = frequency ratios relative to reference_hz. 'cents_above_reference' = cents above the reference. 'hz_absolute' = explicit Hz values (reference_hz then ignored)."
        },
        "reference_hz": {
          "type": "number",
          "minimum": 20,
          "maximum": 4000,
          "description": "The reference pitch (1/1 or 0 cents). Typically the drone or tonic. Irrelevant if encoding=hz_absolute."
        },
        "pitches": {
          "type": "array",
          "minItems": 1,
          "items": {"type": "number"},
          "description": "The pitches of the system. Must not include the octave-repetition — that is inferred from octave_repeats. Example (ratio): [1, 9/8, 5/4, 4/3, 3/2, 5/3, 15/8]"
        },
        "octave_repeats": {
          "type": "boolean",
          "description": "If true, pitches are assumed to repeat at 2:1 above and below. If false, the system is non-octave-repeating (must match scale_topology in the field notes)."
        },
        "inflection_rules": {
          "type": "array",
          "items": {
            "type": "object",
            "properties": {
              "pitch_index": {"type": "integer"},
              "inflection_cents_range": {"type": "array", "items": {"type": "number"}, "minItems": 2, "maxItems": 2},
              "direction": {"enum": ["up", "down", "both"]}
            }
          },
          "description": "Optional. Rules for microtonal inflection applied to specific pitches at performance time. Example: [{pitch_index: 2, inflection_cents_range: [-30, 0], direction: 'down'}] for a pitch bent down by up to 30 cents."
        }
      }
    },

    "rhythm_system": {
      "oneOf": [
        {
          "type": "object",
          "required": ["type", "tempo_bpm", "beats_per_cycle"],
          "properties": {
            "type": {"const": "metric"},
            "tempo_bpm": {"type": "number", "minimum": 20, "maximum": 300},
            "beats_per_cycle": {"type": "integer", "minimum": 1},
            "subdivisions_per_beat": {"type": "integer", "default": 4},
            "accent_pattern": {"type": "array", "items": {"type": "number"}, "description": "One value per beat, 0.0-1.0, relative strength."}
          }
        },
        {
          "type": "object",
          "required": ["type", "groupings", "base_unit_ms"],
          "properties": {
            "type": {"const": "additive"},
            "groupings": {"type": "array", "items": {"type": "integer"}, "description": "E.g. [7, 7, 9] for 23-unit additive cycle."},
            "base_unit_ms": {"type": "number", "minimum": 30, "maximum": 2000}
          }
        },
        {
          "type": "object",
          "required": ["type", "phrase_durations_seconds"],
          "properties": {
            "type": {"const": "pulse_free"},
            "phrase_durations_seconds": {"type": "array", "items": {"type": "number"}, "description": "Explicit list of phrase durations. Each phrase is a unit of performance."}
          }
        },
        {
          "type": "object",
          "required": ["type", "breath_count", "breath_duration_range_seconds"],
          "properties": {
            "type": {"const": "breath_based"},
            "breath_count": {"type": "integer", "minimum": 1},
            "breath_duration_range_seconds": {"type": "array", "items": {"type": "number"}, "minItems": 2, "maxItems": 2},
            "between_breaths_seconds": {"type": "array", "items": {"type": "number"}, "minItems": 2, "maxItems": 2, "default": [0.3, 1.5]}
          }
        },
        {
          "type": "object",
          "required": ["type", "cycle_duration_seconds", "event_density_per_cycle"],
          "properties": {
            "type": {"const": "cyclical_nonmetric"},
            "cycle_duration_seconds": {"type": "number"},
            "event_density_per_cycle": {"type": "integer"},
            "cycle_count": {"type": "integer", "minimum": 1}
          }
        },
        {
          "type": "object",
          "required": ["type", "cue_points_seconds"],
          "properties": {
            "type": {"const": "ritual_cued"},
            "cue_points_seconds": {"type": "array", "items": {"type": "number"}, "description": "Times at which a ritual cue (e.g. bell, shout, gesture) advances the form."}
          }
        },
        {
          "type": "object",
          "required": ["type"],
          "properties": {
            "type": {"const": "indeterminate_proportional"},
            "notation_note": {"type": "string", "description": "Free-text description of the proportional timing rule."}
          }
        }
      ]
    },

    "voices": {
      "type": "array",
      "minItems": 1,
      "items": {
        "type": "object",
        "required": ["name", "timbre", "pitch_indices", "rhythm_role", "amplitude"],
        "properties": {
          "name": {"type": "string"},
          "timbre": {
            "type": "string",
            "description": "Short descriptor. Synth engine will map to its available voices. Examples: 'sine', 'vocal_male_low', 'bowed_string', 'struck_metal', 'reed', 'breath_noise', 'plucked_string', 'overtone_whistle'."
          },
          "pitch_indices": {
            "type": "array",
            "items": {"type": "integer"},
            "description": "Indices into pitch_system.pitches. The voice draws from these pitches."
          },
          "rhythm_role": {
            "enum": ["sustained_drone", "ostinato", "melodic_lead", "ornamental", "hocket_single_pitch", "percussive", "ritual_punctuation", "breath_phrase"],
            "description": "How the voice relates to the rhythm system."
          },
          "amplitude": {"type": "number", "minimum": 0.0, "maximum": 1.0},
          "spatial_position": {
            "type": "array",
            "items": {"type": "number"},
            "minItems": 2,
            "maxItems": 2,
            "description": "Optional [x, y] in [-1, 1] stereo/quad space. Default [0, 0]. Used for spatially_distributed ensembles."
          },
          "active_sections": {
            "type": "array",
            "items": {"type": "string"},
            "description": "Optional. Section names in form.sections during which this voice is active. Default: all sections."
          }
        }
      }
    },

    "form": {
      "type": "object",
      "required": ["arc_type", "sections"],
      "properties": {
        "arc_type": {
          "enum": ["static", "cyclical", "arc_buildup", "through_composed", "modular"],
          "description": "Overall form. Must match formal_type in field notes."
        },
        "sections": {
          "type": "array",
          "minItems": 1,
          "items": {
            "type": "object",
            "required": ["name", "start_seconds", "duration_seconds"],
            "properties": {
              "name": {"type": "string"},
              "start_seconds": {"type": "number", "minimum": 0},
              "duration_seconds": {"type": "number", "minimum": 1},
              "character": {"type": "string", "description": "One-line descriptor of this section's character. E.g. 'sparse, single voice' or 'full ensemble, accelerating'."},
              "chord_tones": {"type": "array", "items": {"type": "integer"}, "description": "Optional. Indices into pitch_system.pitches that form the harmonic ground of this section. Voices without scripted events will be biased toward these pitches on downbeats — gives the ensemble vertical harmonic alignment. Typical: 3–5 tones."}
            }
          }
        }
      }
    },

    "ornamentation": {
      "type": "object",
      "properties": {
        "density": {"type": "number", "minimum": 0.0, "maximum": 1.0},
        "rule": {"type": "string", "description": "How and when ornaments are applied. E.g. 'Every sustained pitch longer than 2 s receives a descending meend of 20–50 cents.'"}
      }
    },

    "events": {
      "type": "array",
      "description": "Optional explicit event list. If provided, overrides the rhythm_system + voices interaction for parts of the piece that need precise scripting. Prefer generative parameters where possible — only use events when the grammar explicitly requires it.",
      "items": {
        "type": "object",
        "required": ["t", "voice", "pitch_index", "duration_seconds"],
        "properties": {
          "t": {"type": "number", "description": "Onset time in seconds"},
          "voice": {"type": "string", "description": "Voice name"},
          "pitch_index": {"type": "integer"},
          "duration_seconds": {"type": "number"},
          "amplitude": {"type": "number", "minimum": 0.0, "maximum": 1.0},
          "ornament": {"type": "string", "description": "Optional. Named ornament to apply — must match something defined in ornamentation.rule."}
        }
      }
    }
  }
}
